<?xml version="1.0" encoding="UTF-8"?>

<!DOCTYPE ActuatorType SYSTEM "ActuatorTypeDTD.dtd">

<ActuatorType name="org.cougaar.coordinator.examples.SampleDefense.SampleAction" 
              affectsAssetType="Agent" 
              affectsStateDimension="Compromised" 
              actionType="CORRECTIVE">

    <Action name="Quarantine">
        <Description value="Quarantine the Agent so it can do no harm" />
        <Transition WhenActualStateIs="Yes" EndStateWillBe="Isolated" IntermediateStateWillBe="Yes" >
            <OneTimeCost>
                <CPU intensity="MEDIUM" />
                <Memory intensity="MEDIUM" />
                <Time duration="60000" />
            </OneTimeCost>
            <ContinuingCost>
                <Bandwidth intensity="MEDIUM" msgSizeFactor="TRUE" />
                <CPU intensity="MEDIUM" msgSizeFactor="TRUE" />
            </ContinuingCost>
        </Transition>
        <Transition WhenActualStateIs="No" EndStateWillBe="Isolated" IntermediateStateWillBe="No" >
            <OneTimeCost>
                <CPU intensity="MEDIUM" />
                <Memory intensity="MEDIUM" />
                <Time duration="60000" />
            </OneTimeCost>
            <ContinuingCost>
                <Bandwidth intensity="MEDIUM" msgSizeFactor="TRUE" />
                <CPU intensity="MEDIUM" msgSizeFactor="TRUE" />
            </ContinuingCost>
        </Transition>
        <Transition WhenActualStateIs="Isolated" EndStateWillBe="Isolated" IntermediateStateWillBe="Isolated" >
            <OneTimeCost>
                <CPU intensity="MEDIUM" />
                <Memory intensity="MEDIUM" />
                <Time duration="60000" />
            </OneTimeCost>
            <ContinuingCost>
                <Bandwidth intensity="MEDIUM" msgSizeFactor="TRUE" />
                <CPU intensity="MEDIUM" msgSizeFactor="TRUE" />
            </ContinuingCost>
        </Transition>
    </Action>

    <Action name="Release">
        <Description value="Release the (presumably sanitized) Agent so it can do work" />
        <Transition WhenActualStateIs="Yes" EndStateWillBe="Yes" IntermediateStateWillBe="Yes" >
            <OneTimeCost>
                <CPU intensity="MEDIUM" />
                <Memory intensity="MEDIUM" />
                <Time duration="60000" />
            </OneTimeCost>
        </Transition>
        <Transition WhenActualStateIs="No" EndStateWillBe="No" IntermediateStateWillBe="No" >
            <OneTimeCost>
                <CPU intensity="MEDIUM" />
                <Memory intensity="MEDIUM" />
                <Time duration="60000" />
            </OneTimeCost>
        </Transition>
        <Transition WhenActualStateIs="Isolated" EndStateWillBe="No" IntermediateStateWillBe="Isolated" >
            <OneTimeCost>
                <CPU intensity="MEDIUM" />
                <Memory intensity="MEDIUM" />
                <Time duration="60000" />
            </OneTimeCost>
        </Transition>
    </Action>
    
</ActuatorType>